{"id":"q-fixture-est","schema_version":"1.0.0","content_version":"0.1.0","title":"fixture exercise","created_at":"2026-08-24T00:00:00+09:00","updated_at":"2026-08-24T00:00:00+09:00","unit_id":"unit-02a","exercise_type":"selected-response","prompt":"構造検査用の選択肢を選ぶ。","stimulus":{"text":"est"},"skills":["reading.finite-verb.identify"],"vocabulary":["lex-fixture-est"],"prerequisites":[],"answer_mode":"single-choice","accepted_answers":["a"],"rejected_answers":["b"],"normalization_profile_id":"structured-features","collision_check":{"status":"pass","checked_content_version":"0.1.0","note":"fixture内で識別子が分離する。"},"choices":[{"choice_id":"a","text":"A","is_correct":true,"misconception_tags":[]},{"choice_id":"b","text":"B","is_correct":false,"misconception_tags":["fixture.wrong"]}],"feedback":[{"condition":"incorrect","message":"既習技能を確認する。","review_skills":["reading.finite-verb.identify"]}],"misconception_tags":["fixture.wrong"],"evidence":[{"kind":"generated-rationale","claim_scope":"fixture structure","note":"本番問題ではない。"}],"source_refs":[],"review":{"draft_status":"draft","source_checked":[],"editorial_approved":[],"expert_reviewed":[],"automated_validation":[]},"automatic_scoring":true,"scoring_target":"structured-features","notes":"fixture only"}
